{
  "$schema": "./schemas/plugin-manifest.json",
  "id": "character-info",
  "name": "Character",
  "author": "holtburger",
  "version": "0.1.0",
  "description": "Character view — Attributes / Skills / Titles in one pane (retail gmStatManagementUI template 0x21000045: header with level + XP meter, sectioned list, +1/+10 raise footer). F1 toggles (last-used tab); F11 opens the Skills tab. Mounts as a view of plugins/main-panel.js.",
  "icon": "👤",
  "iconHidden": true,
  "entry": "./character-info.js",
  "environments": ["browser"],
  "slots": ["panel"],
  "hotkeys": [
    { "id": "toggle", "default": "F1", "label": "Toggle Character" }
  ],
  "clientApi": "^1.0",
  "capabilities": ["GetPlayerStats", "RaiseSkill", "TrainSkill", "RaiseAttribute", "RaiseVital"]
}
