{
  "$schema": "./schemas/plugin-manifest.json",
  "id": "emote-panel",
  "name": "Emote Palette",
  "author": "holtburger",
  "version": "0.2.0",
  "description": "Retail soul-emote palette (DAT ChatPoseTable) — click to /wave, /bow, /sit …, plus /me free text. Shift+F2 toggles.",
  "icon": "☺",
  "entry": "./emote-panel.js",
  "environments": ["browser"],
  "slots": ["panel"],
  "hotkeys": [
    { "id": "toggle", "default": "Shift+F2", "label": "Toggle Emotes" }
  ],
  "clientApi": "^1.0"
}
