{
  "$schema": "./schemas/plugin-manifest.json",
  "id": "sneak-hud",
  "name": "Sneak Attack HUD",
  "author": "holtburger",
  "version": "0.2.0",
  "description": "Transient 'Sneak Attack! +N damage rating' overlay on facing-gated swings",
  "icon": "🗡",
  "iconHidden": true,
  "entry": "./sneak-hud.js",
  "environments": ["browser"],
  "slots": ["hud", "overlay"],
  "clientApi": "^1.0"
}
