{
  "$schema": "./schemas/plugin-manifest.json",
  "id": "buffs-hud",
  "name": "Buffs",
  "author": "holtburger",
  "version": "0.4.0",
  "description": "Active effects window — positive / negative effects and cooldowns with time left",
  "icon": "✦",
  "iconHidden": true,
  "entry": "./buffs-hud.js",
  "environments": ["browser"],
  "slots": ["hud", "overlay"],
  "dependencies": ["spellbook@^0.2.0?"]
}
