{
  "$schema": "./schemas/plugin-manifest.json",
  "id": "stance-toggle",
  "name": "Combat Stance",
  "author": "holtburger",
  "version": "0.1.0",
  "description": "Combat-mode helpers for the toolbar stance button + bar-icon stance tint",
  "icon": "⚐",
  "entry": "./stance-toggle.js",
  "environments": ["browser"],
  "slots": ["bar"],
  "clientApi": "^1.0"
}
