{
  "$schema": "./schemas/plugin-manifest.json",
  "id": "radar",
  "name": "Compass",
  "author": "holtburger",
  "version": "0.2.0",
  "description": "Top-right heading-up radar/compass (retail gmRadarUI 0x21000074)",
  "icon": "🧭",
  "iconHidden": true,
  "entry": "./radar.js",
  "environments": ["browser"],
  "slots": ["hud", "overlay"],
  "clientApi": "^1.0"
}
