{
  "$schema": "./schemas/plugin-manifest.json",
  "id": "allegiance-panel",
  "name": "Allegiance",
  "author": "holtburger",
  "version": "0.4.0",
  "description": "Allegiance tab of the social hub (gmAllegianceUI 0x2100002F) + management floaty",
  "icon": "🛡",
  "iconHidden": true,
  "entry": "./allegiance-panel.js",
  "environments": ["browser"],
  "slots": ["panel"],
  "hotkeys": [
    { "id": "toggle", "default": "F8", "label": "Toggle Allegiance" }
  ],
  "clientApi": "^1.0"
}
