{
  "$schema": "./schemas/plugin-manifest.json",
  "id": "map-panel",
  "name": "Map",
  "author": "holtburger",
  "version": "0.2.0",
  "description": "Map of Dereth (gmMapUI 0x21000026, world bitmap 0x0600127D) + expanded world map (M)",
  "icon": "🗺",
  "iconHidden": true,
  "entry": "./map-panel.js",
  "environments": ["browser"],
  "slots": ["panel"],
  "hotkeys": [
    { "id": "toggle", "default": "F3", "label": "Toggle Map" }
  ],
  "clientApi": "^1.0"
}
