{
  "$schema": "./schemas/plugin-manifest.json",
  "id": "house-panel",
  "name": "House",
  "author": "holtburger",
  "version": "0.2.0",
  "description": "Housing — status, buy / maintenance via the covenant crystal, guests",
  "icon": "H",
  "iconHidden": true,
  "entry": "./house-panel.js",
  "environments": ["browser"],
  "slots": ["panel"],
  "hotkeys": [
    { "id": "toggle", "default": "Shift+F6", "label": "Toggle House" }
  ],
  "clientApi": "^1.0"
}
