{
  "$schema": "./schemas/plugin-manifest.json",
  "id": "salvage-panel",
  "name": "Salvage",
  "author": "holtburger",
  "version": "0.2.0",
  "description": "Salvage window (gmSalvageUI) — drag items in, confirm, see the material results",
  "icon": "⚒",
  "iconHidden": true,
  "entry": "./salvage-panel.js",
  "environments": ["browser"],
  "slots": ["overlay"],
  "clientApi": "^1.0",
  "capabilities": ["UseWithTarget", "GetObjectAppraisal"]
}
