{
  "$schema": "./schemas/plugin-manifest.json",
  "id": "target-bar",
  "name": "Target Bar",
  "author": "holtburger",
  "version": "0.2.0",
  "description": "Retail gmToolbarUI controls (combat mode, 6 panel buttons, Use/Selected/Examine, backpack) — mounted inside the unified #hb-hotbar toolbar",
  "icon": "⊙",
  "iconHidden": true,
  "entry": "./target-bar.js",
  "environments": ["browser"],
  "slots": ["hud", "overlay"],
  "clientApi": "^1.0",
  "capabilities": ["ChangeCombatMode", "ToggleCombatMode", "UseObject"]
}
