{
  "$schema": "./schemas/plugin-manifest.json",
  "id": "vitae-detail",
  "name": "Vitae Detail",
  "author": "holtburger",
  "version": "0.2.0",
  "description": "Retail gmVitaeUI — vitae penalty + experience owed for the next 1%; click the status-indicators Vitae icon to toggle.",
  "icon": "💀",
  "iconHidden": true,
  "entry": "./vitae-detail.js",
  "environments": ["browser"],
  "slots": ["overlay"],
  "clientApi": "^1.0",
  "capabilities": ["GetPlayerStats"]
}
