{
  "$schema": "./schemas/plugin-manifest.json",
  "id": "journal-panel",
  "name": "Journal",
  "author": "holtburger",
  "version": "0.3.0",
  "description": "Journal (gmJournalUI 0x21000066 parchment): quest log + retail paged notebook",
  "icon": "📜",
  "iconHidden": true,
  "entry": "./journal-panel.js",
  "environments": ["browser"],
  "slots": ["panel"],
  "hotkeys": [
    { "id": "toggle", "default": "F6", "label": "Toggle Journal" }
  ],
  "clientApi": "^1.0"
}
