{
  "$schema": "./schemas/plugin-manifest.json",
  "id": "hover-tooltip",
  "name": "Hover Tooltip",
  "author": "holtburger",
  "version": "0.2.0",
  "description": "Retail ToolTip_ObjectName popup with entity name / level / health / quality on cursor rest; zoom-aware placement (rec #193).",
  "icon": "?",
  "iconHidden": true,
  "entry": "./hover-tooltip.js",
  "environments": ["browser"],
  "slots": ["watcher"],
  "clientApi": "^1.0"
}
