{
  "$schema": "./schemas/plugin-manifest.json",
  "id": "modal-dialog",
  "name": "Modal Dialog",
  "author": "holtburger",
  "version": "0.2.0",
  "description": "Retail-chrome modal confirm replacing window.confirm — Promise + callback APIs.",
  "icon": "◆",
  "iconHidden": true,
  "entry": "./modal-dialog.js",
  "environments": ["browser"],
  "slots": ["overlay"],
  "clientApi": "^1.0"
}
